[
  {
    "service": "auth",
    "role": "auth_user",
    "passwordEnvVar": "AUTH_DB_PASSWORD",
    "schema": "schema_auth",
    "grants": {
      "schema": ["USAGE", "CREATE"],
      "tables": ["SELECT", "INSERT", "UPDATE", "DELETE"],
      "sequences": ["USAGE", "SELECT", "UPDATE"],
      "functions": ["EXECUTE"]
    }
  },
  {
    "service": "collab",
    "role": "collab_user",
    "passwordEnvVar": "COLLAB_DB_PASSWORD",
    "schema": "schema_collab",
    "grants": {
      "schema": ["USAGE", "CREATE"],
      "tables": ["SELECT", "INSERT", "UPDATE", "DELETE"],
      "sequences": ["USAGE", "SELECT", "UPDATE"],
      "functions": ["EXECUTE"]
    }
  },
  {
    "service": "media",
    "role": "media_user",
    "passwordEnvVar": "MEDIA_DB_PASSWORD",
    "schema": "schema_media",
    "grants": {
      "schema": ["USAGE", "CREATE"],
      "tables": ["SELECT", "INSERT", "UPDATE", "DELETE"],
      "sequences": ["USAGE", "SELECT", "UPDATE"],
      "functions": ["EXECUTE"]
    }
  },
  {
    "service": "marketing",
    "role": "marketing_user",
    "passwordEnvVar": "MARKETING_DB_PASSWORD",
    "schema": "schema_marketing",
    "grants": {
      "schema": ["USAGE", "CREATE"],
      "tables": ["SELECT", "INSERT", "UPDATE", "DELETE"],
      "sequences": ["USAGE", "SELECT", "UPDATE"],
      "functions": ["EXECUTE"]
    }
  },
  {
    "service": "customers",
    "role": "customers_user",
    "passwordEnvVar": "CUSTOMERS_DB_PASSWORD",
    "schema": "schema_customers",
    "grants": {
      "schema": ["USAGE", "CREATE"],
      "tables": ["SELECT", "INSERT", "UPDATE", "DELETE"],
      "sequences": ["USAGE", "SELECT", "UPDATE"],
      "functions": ["EXECUTE"]
    }
  }
]
